Relacionada com Meio Ambiente ou Clima?,Pos/Neg/Neutro para o ambientalismo,proposicao,sigla_tipo,numero,ano,ementa,id,casa,tema,autor,link
Sim,Positivo,PRS 5/2020,PRS,5,2020,"Institui, no âmbito do Senado Federal, a Comenda Marechal Cândido Rondon, destinada a homenagear personalidades que tenham oferecido contribuição relevante no campo do indigenismo, do ambientalismo e do pacifismo no Brasil.",140760,senado,Nao especificado,Luiz Pastore MDB / ES,https://www25.senado.leg.br/web/atividade/materias/-/materia/140760
Sim,Positivo,PRS 12/2020,PRS,12,2020,Institui o Grupo Parlamentar do Parlamento Amazônico.,141238,senado,Nao especificado,Nelsinho Trad PSD / MS,https://www25.senado.leg.br/web/atividade/materias/-/materia/141238
Sim,Positiva: estimula a preservação de vegetação nativa como forma de concessão de benefícios fiscais.,PEC 13/2019,PEC,13,2019,"Altera o art. 156 da Constituição Federal, para estabelecer critérios ambientais para a cobrança do Imposto sobre Propriedade Predial e Territorial Urbana e desonerar a parcela do imóvel com vegetação nativa.",135609,senado,Meio ambiente,Plínio Valério PSDB / AM e outros,https://www25.senado.leg.br/web/atividade/materias/-/materia/135609
Sim,Positivo - Convertido em Resolução do Senado (02/2019),PRS 13/2019,PRS,13,2019,"Autoriza o Município de Fortaleza, situado no Estado do Ceará, a contratar operação de crédito externo, com garantia da República Federativa do Brasil, junto ao Banco Internacional para Reconstrução e Desenvolvimento (BIRD), no valor de até US$ 73.300.000,00 (setenta e três milhões e trezentos mil dólares dos Estados Unidos da América).",135464,senado,Nao especificado,Comissão de Assuntos Econômicos,https://www25.senado.leg.br/web/atividade/materias/-/materia/135464
Sim,Neutro,PRS 19/2019,PRS,19,2019,Cria a Frente Parlamentar Mista para defesa dos Estados do Nordeste.,135602,senado,Nao especificado,Weverton PDT / MA,https://www25.senado.leg.br/web/atividade/materias/-/materia/135602
Sim,Positivo - Convertido em Resolução do Senado (3/2020),PRS 22/2020,PRS,22,2020,"Autoriza o Município de São Bernardo do Campo, situado no Estado de São Paulo, a contratar operação de crédito externo, com garantia da República Federativa do Brasil, junto à Corporação Andina de Fomento (CAF), no valor de até US$ 80.000.000,00 (oitenta milhões de dólares dos Estados Unidos da América).",142024,senado,Nao especificado,Major Olimpio PSL / SP,https://www25.senado.leg.br/web/atividade/materias/-/materia/142024
Sim,Positivo,PEC 24/2020,PEC,24,2020,"Altera o art. 225 da Constituição Federal para incluir, entre as incumbências do Poder Público, o estímulo a práticas de pagamento por serviços ambientais e a oferta de incentivos para a geração de empregos e formação de recursos humanos em atividades que contribuam para a qualidade ambiental.",142971,senado,Meio ambiente,Jaques Wagner PT / BA e outros,https://www25.senado.leg.br/web/atividade/materias/-/materia/142971
Sim,Positivo - Convertido em Resolução do Senado (6/2020),PRS 24/2020,PRS,24,2020,"Autoriza o Município de Mogi das Cruzes (SP) a contratar operação de crédito externo, com garantia da República Federativa do Brasil, com a Corporação Andina de Fomento (CAF), no valor de até US$ 69.439.000,00 (sessenta e nove milhões, quatrocentos e trinta e nove mil dólares dos Estados Unidos da América).",142794,senado,Nao especificado,Comissão de Assuntos Econômicos,https://www25.senado.leg.br/web/atividade/materias/-/materia/142794
Sim,Negativo,PDL 25/2019,PDL,25,2019,"Exclui da Área Indígena WAIMIRIATROARI o leito da BR 174, no Estado de Roraima.",135165,senado,Nao especificado,Mecias de Jesus REPUBLICANOS / RR,https://www25.senado.leg.br/web/atividade/materias/-/materia/135165
Sim,Neutra,PRS 27/2019,PRS,27,2019,Cria a Frente Parlamentar Mista para defesa do Consórcio Interestadual de Desenvolvimento Sustentável do Nordeste – (Consórcio Nordeste),135858,senado,Nao especificado,Weverton PDT / MA e outros,https://www25.senado.leg.br/web/atividade/materias/-/materia/135858
Sim,Negativo: exclui sem determinar compensação pela redução da a´rea.,PDL 28/2019,PDL,28,2019,"Exclui da Terra Indígena São Marcos a área urbana da sede do Município de Pacaraima, no Estado de Roraima.",135175,senado,Nao especificado,Mecias de Jesus REPUBLICANOS / RR,https://www25.senado.leg.br/web/atividade/materias/-/materia/135175
Sim,Positivo - Convertido em Resolução do Senado (05/2019),PRS 37/2019,PRS,37,2019,"Autoriza o Município de Camaçari (BA) a contratar operação de crédito externo, com garantia da República Federativa do Brasil, com a Corporação Andina de Fomento (CAF), no valor de até US$ 80.000.000,00 (oitenta milhões de dólares dos Estados Unidos da América).",136423,senado,Nao especificado,Comissão de Assuntos Econômicos,https://www25.senado.leg.br/web/atividade/materias/-/materia/136423
Sim,Positivo - Convertido em Resolução do Senado (07/2019),PRS 41/2019,PRS,41,2019,"Autoriza o Município de Vitória, situado no Estado do Espírito Santo, a contratar operação de crédito externo, com garantia da República Federativa do Brasil, junto ao Banco Interamericano de Desenvolvimento (BID), no valor de até US$ 100.000.000,00 (cem milhões de dólares dos Estados Unidos da América).",136596,senado,Nao especificado,Comissão de Assuntos Econômicos,https://www25.senado.leg.br/web/atividade/materias/-/materia/136596
Sim,Positivo,PRS 49/2019,PRS,49,2019,"Institui, no âmbito do Senado Federal, o Diploma Paul Singer.",136879,senado,Nao especificado,Jaques Wagner PT / BA,https://www25.senado.leg.br/web/atividade/materias/-/materia/136879
Sim,Positivo - Convertido em Resolução do Senado (14/2020),PRS 52/2019,PRS,52,2019,Dispõe sobre a criação da campanha “Junho Verde” para conscientização sobre a importância da preservação do meio ambiente.,137065,senado,Nao especificado,Fabiano Contarato REDE / ES e outros,https://www25.senado.leg.br/web/atividade/materias/-/materia/137065
Sim,Negativo,PDL 67/2020,PDL,67,2020,"Susta, nos termos do inciso V do art. 49 da Constituição Federal, a Portaria nº 50, de 21 de janeiro de 2016, do Ministério da Justiça/Fundação Nacional do Índio, e a Portaria nº 17, de 9 de janeiro de 2019, do Ministério da Mulher, da Família e dos Direitos Humanos/Fundação Nacional do Índio/Diretoria de Proteção Territorial.",140895,senado,Nao especificado,Zequinha Marinho PSC / PA,https://www25.senado.leg.br/web/atividade/materias/-/materia/140895
Sim,Negativo: precariza o licenciamento ambintal criando a figura da licença ambiental tácita.,PLP 71/2019,PLP,71,2019,"Altera o art. 14 da Lei Complementar Nº 140, de 8 de dezembro de 2011, para dispor sobre os prazos estabelecidos para tramitação dos processos de licenciamento ambiental.",135796,senado,Meio ambiente,Marcio Bittar MDB / AC,https://www25.senado.leg.br/web/atividade/materias/-/materia/135796
Sim,Positivo - Convertido em Resolução do Senado (12/2019),PRS 84/2019,PRS,84,2019,"Autoriza o Estado de Mato Grosso a contratar operação de crédito externo, com garantia da República Federativa do Brasil, com o Banco Internacional para Reconstrução e Desenvolvimento (BIRD), no valor de até US$ 250.000.000,00 (duzentos e cinquenta milhões de dólares dos Estados Unidos da América).",138549,senado,Nao especificado,Comissão de Assuntos Econômicos,https://www25.senado.leg.br/web/atividade/materias/-/materia/138549
Sim,Positivo,PRS 85/2019,PRS,85,2019,"Institui o Prêmio Chico Mendes do Senado Federal, a ser conferido anualmente a matérias jornalísticas que tratem da preservação do Meio Ambiente.",138552,senado,Nao especificado,Fabiano Contarato REDE / ES,https://www25.senado.leg.br/web/atividade/materias/-/materia/138552
Sim,Positivo,PDL 85/2020,PDL,85,2020,"Susta a Instrução Normativa nº 7, de 21 de Fevereiro de 2020 do Instituto Brasileiro do Meio Ambiente e do Recursos Naturais Renováveis (IBAMA) que estabelece controle a posteriori para a exportação de madeiras, indicadas no Anexo II.",141084,senado,Nao especificado,Rogério Carvalho PT / SE e outros,https://www25.senado.leg.br/web/atividade/materias/-/materia/141084
Sim,positivo,PL 90/2020,PL,90,2020,Proíbe a produção e a comercialização de qualquer produto alimentício obtido por meio de método de alimentação forçada de animais.,140489,senado,Meio ambiente,Eduardo Girão PODEMOS / CE,https://www25.senado.leg.br/web/atividade/materias/-/materia/140489
Sim,Positivo - Convertido em Resolução do Senado (24/2019),PRS 100/2019,PRS,100,2019,"Autoriza a concessão de garantia da República Federativa do Brasil à operação de crédito externo a ser contratada pela Companhia de
Saneamento Básico do Estado de São Paulo (Sabesp) junto ao Banco Internacional para Reconstrução e Desenvolvimento (BIRD) no valor de até US$ 250.000.000,00 (duzentos e cinquenta milhões de dólares dos Estados
Unidos da América).",139111,senado,Nao especificado,Comissão de Assuntos Econômicos,https://www25.senado.leg.br/web/atividade/materias/-/materia/139111
Sim,Positivo,PL 135/2020,PL,135,2020,"Altera a Lei nº 12.651, de 25 de maio de 2012 (Código Florestal), para estabelecer que áreas rurais com floresta nativa submetidas a queimadas ilegais serão destinadas a reflorestamento.",140530,senado,Meio ambiente,Jorge Kajuru CIDADANIA / GO,https://www25.senado.leg.br/web/atividade/materias/-/materia/140530
Sim,Positivo,PL 145/2020,PL,145,2020,"Proíbe, em todo o território nacional, a utilização, a fabricação, a importação, a comercialização e a distribuição de sacolas para o acondicionamento e o transporte de mercadorias que contenham, em sua composição, polímeros plásticos.",140541,senado,Meio ambiente,Ciro Nogueira PP / PI,https://www25.senado.leg.br/web/atividade/materias/-/materia/140541
Sim,positivo,PL 149/2019,PL,149,2019,"Institui a Política Nacional de Incentivo à Agricultura e Pecuária de Precisão para ampliação da eficiência na aplicação de recursos e insumos de produção, de forma a diminuir o desperdício, reduzir os custos de produção, aumentar a produtividade e a lucratividade, bem como garantir a sustentabilidade ambiental, social e econômica.",140314,senado,"Agricultura, pecuária e abastecimento",Câmara dos Deputados,https://www25.senado.leg.br/web/atividade/materias/-/materia/140314
Sim,Positivo,PEC 184/2019,PEC,184,2019,Altera a Constituição Federal para instituir o Fundo Nacional de Responsabilidade por Poluição Causada por Incidentes com Hidrocarbonetos.,139657,senado,Meio ambiente,Confúcio Moura MDB / RO e outros,https://www25.senado.leg.br/web/atividade/materias/-/materia/139657
Sim,Positivo,PDL 187/2020,PDL,187,2020,"Susta a Instrução Normativa nº 9, de 16 de abril de 2020, do Ministério da Justiça/Fundação Nacional do Índio, que “Disciplina o requerimento, análise e emissão da Declaração de Reconhecimento de Limites em relação a imóveis privados.”",141764,senado,Nao especificado,Randolfe Rodrigues REDE / AP,https://www25.senado.leg.br/web/atividade/materias/-/materia/141764
Sim,Positivo,PL 189/2020,PL,189,2020,"Altera a Lei nº 9.605, de 12 de fevereiro de 1998, para prever que a responsabilização penal da pessoa jurídica independe da responsabilização da pessoa física que a represente.",140613,senado,Meio ambiente,Roberto Rocha PSDB / MA,https://www25.senado.leg.br/web/atividade/materias/-/materia/140613
Sim,Positivo,PDL 202/2019,PDL,202,2019,"Susta, nos termos do inciso V do art. 49 da Constituição Federal, os efeitos do Decreto nº 9.760, de 11 de abril de 2019, que altera o Decreto nº 6.514, de 22 de julho de 2008, que dispõe sobre as infrações e sanções administrativas ao meio ambiente e estabelece o processo administrativo federal para apuração destas infrações.",136417,senado,Nao especificado,Fabiano Contarato REDE / ES,https://www25.senado.leg.br/web/atividade/materias/-/materia/136417
Sim,Neutro,PEC 202/2019,PEC,202,2019,Altera os arts. 49 e 225 da Constituição Federal para que o Congresso Nacional decida previamente sobre o corte e a supressão de vegetação da Floresta Amazônica.,139916,senado,Meio ambiente,Alessandro Vieira CIDADANIA / SE e outros,https://www25.senado.leg.br/web/atividade/materias/-/materia/139916
Sim,Positivo,PEC 203/2019,PEC,203,2019,"Insere o § 3o no art. 20 e o inciso VIII no § 1º do art. 225 da Constituição Federal, para instituir o Fundo Nacional para Emergências Ambientais, e acrescenta o art. 115 no Ato das Disposições Constitucionais Transitórias, para estabelecer a fonte de recursos para o Fundo.",139917,senado,Meio ambiente,Alessandro Vieira CIDADANIA / SE e outros,https://www25.senado.leg.br/web/atividade/materias/-/materia/139917
Sim,Positivo,PEC 212/2019,PEC,212,2019,"Insere o § 3º no art. 20 da Constituição Federal para prover recursos para fundo de prevenção e recuperação de danos ambientais provocados por atividades de extração, transporte e processamento de recursos petrolíferos e minerais.",140081,senado,Meio ambiente,Jader Barbalho MDB / PA e outros,https://www25.senado.leg.br/web/atividade/materias/-/materia/140081
Sim,Positivo,PDL 226/2020,PDL,226,2020,"Susta o Decreto n° 10.347, de 13 de maio de 2020, que dispõe sobre as competências para a concessão de florestas públicas, em âmbito federal.",141968,senado,Nao especificado,Rogério Carvalho PT / SE,https://www25.senado.leg.br/web/atividade/materias/-/materia/141968
,Não relacionado ao meio ambiente ou clima.,PDL 233/2019,PDL,233,2019,"Susta o Decreto nº 9.785, de 07 de Maio de 2019, que regulamenta a Lei nº 10.826, de 22 de dezembro de 2003, para dispor sobre a aquisição, o cadastro, o registro, a posse, o porte e a comercialização de armas de fogo e de munição e sobre o Sistema Nacional de Armas e o Sistema Nacional de Gerenciamento Militar de Armas.",136635,senado,Nao especificado,Randolfe Rodrigues REDE / AP,https://www25.senado.leg.br/web/atividade/materias/-/materia/136635
Sim,Positivo,PEC 233/2019,PEC,233,2019,Acrescenta o inciso X ao art. 170 e o inciso VIII ao § 1º do art. 225 da Constituição Federal.,140340,senado,Meio ambiente,Acir Gurgacz PDT / RO e outros,https://www25.senado.leg.br/web/atividade/materias/-/materia/140340
,Não relacionado ao meio ambiente ou clima.,PDL 235/2019,PDL,235,2019,"Susta o Decreto nº 9.785, de 7 de maio de 2019, que regulamenta a Lei nº 10.826, de 22 de dezembro de 2003, para dispor sobre a aquisição, o cadastro. O registro, a posse, o porte e a comercialização de armas de fogo e de munição e sobre o Sistema Nacional de Armas e o Sistema Ncional de Gerenciamento Militar de Armas.",136640,senado,Nao especificado,Humberto Costa PT / PE e outros,https://www25.senado.leg.br/web/atividade/materias/-/materia/136640
,Não relacionado ao meio ambiente ou clima.,PDL 238/2019,PDL,238,2019,"Susta o Decreto nº 9.785, de 07 de Maio de 2019, que regulamenta a Lei nº 10.826, de 22 de dezembro de 2003, para dispor sobre a aquisição, o cadastro, o registro, a posse, o porte e a comercialização de armas de fogo e de munição e sobre o Sistema Nacional de Armas e o Sistema Nacional de Gerenciamento Militar de Armas.",136653,senado,Nao especificado,Randolfe Rodrigues REDE / AP e outros,https://www25.senado.leg.br/web/atividade/materias/-/materia/136653
Sim,Neutro,PLP 240/2019,PLP,240,2019,"Modifica a Lei Complementar nº 140, de 8 de dezembro de 2011, que fixa normas, nos termos dos incisos III, VI e VII do caput e do parágrafo único do art. 23 da Constituição Federal, para a cooperação entre a União, os Estados, o Distrito Federal e os Municípios nas ações administrativas decorrentes do exercício da competência comum relativas à proteção das paisagens naturais notáveis, à proteção do meio ambiente, ao combate à poluição em qualquer de suas formas e à preservação das florestas, da fauna e da flora, para tornar ação administrativa da União o licenciamento ambiental de empreendimentos com barragem de mineração ou barragem de resíduos industriais cujo rompimento possa poluir lagos e rios de domínio da União.",139622,senado,Meio ambiente,Carlos Viana PSD / MG,https://www25.senado.leg.br/web/atividade/materias/-/materia/139622
,Não relacionado ao meio ambiente ou clima.,PDL 286/2019,PDL,286,2019,"Susta os Decretos nºs 9.785, de 07 de maio de 2019, e 9.797, de 21 de maio de 2019, que regulamentam a Lei nº 10.826, de 22 de dezembro de 2003, para dispor sobre a aquisição, o cadastro, o registro, a posse, o porte e a comercialização de armas de fogo e de munição e sobre o Sistema Nacional de Armas e o Sistema Nacional de Gerenciamento Militar de Armas.",136907,senado,Nao especificado,Randolfe Rodrigues REDE / AP e outros,https://www25.senado.leg.br/web/atividade/materias/-/materia/136907
Sim,Positivo,PL 358/2020,PL,358,2020,"Institui o Selo Nacional de Sustentabilidade Empresarial, conferido a empresas que contribuam para a redução dos impactos ao meio ambiente, e altera a Lei nº 8.666, de 21 de junho de 1993, que institui normas para licitações e contratos da Administração Pública e dá outras providências, para dar preferência, como critério de desempate nas licitações, às empresas detentoras do Selo.",140744,senado,Meio ambiente,Styvenson Valentim PODEMOS / RN,https://www25.senado.leg.br/web/atividade/materias/-/materia/140744
Sim,positivo,PL 415/2020,PL,415,2020,Institui o Fundo Amazônia e dá outras providências.,140818,senado,Meio ambiente,Jorge Kajuru CIDADANIA / GO,https://www25.senado.leg.br/web/atividade/materias/-/materia/140818
Sim,Positivo,PDL 418/2020,PDL,418,2020,"Susta a Resolução do CONAMA – Conselho Nacional do Meio Ambiente, que revoga as Resoluções CONAMA 284/2001, 302/2002 e 303/2002.",144966,senado,Nao especificado,Jaques Wagner PT / BA e outros,https://www25.senado.leg.br/web/atividade/materias/-/materia/144966
Sim,Positivo,PDL 452/2020,PDL,452,2020,"Susta, nos termos do inciso V do art. 49 da Constituição Federal, os efeitos da Resolução nº 499, de 6 de outubro, e da Resolução nº 500, de 21 de outubro, ambas de 2020, do Conselho Nacional do Meio Ambiente – CONAMA.",145213,senado,Nao especificado,Fabiano Contarato REDE / ES e outros,https://www25.senado.leg.br/web/atividade/materias/-/materia/145213
,Não relacionada ao meio ambiente ou clima.,PL 486/2020,PL,486,2020,"Altera a Lei nº 11.326, de 24 de julho de 2006, para incluir a redução das desigualdades sociais e regionais entre os princípios a serem observados pela Política Nacional de Agricultura Familiar e Empreendimentos Familiares Rurais e determina ao Poder Público tratamento especial quanto a linhas de crédito rural e serviços de assistência técnica e extensão rural destinados a agricultores e empreendimentos familiares rurais situados na Região do Marajó.",140937,senado,"Agricultura, pecuária e abastecimento",Zequinha Marinho PSC / PA,https://www25.senado.leg.br/web/atividade/materias/-/materia/140937
Sim,Positivo,PDL 525/2020,PDL,525,2020,"Susta, nos termos do inciso V do art. 49 da Constituição Federal, os efeitos da Portaria Conjunta nº 1, de 2 de dezembro de 2020, do Ministério da Agricultura, Pecuária e Abastecimento.",145734,senado,Nao especificado,Fabiano Contarato REDE / ES,https://www25.senado.leg.br/web/atividade/materias/-/materia/145734
Sim,Negativo: pecariza a preservação de vegetação nativa ao instituir a redução automática diante da não manifestação em 60 dias do poder público.,PL 551/2019,PL,551,2019,"Altera a Lei nº 12.651, de 25 de maio de 2012, que dispõe sobre a proteção da vegetação nativa e dá outras providências, para redefinir critérios para redução da área de Reserva Legal em imóveis rurais da Amazônia Legal.",135117,senado,Meio ambiente,Mecias de Jesus REPUBLICANOS / RR,https://www25.senado.leg.br/web/atividade/materias/-/materia/135117
Sim,"Neutro: os critérios objetivos propostos necessariamente não tornam a aplicação da lei mais célere, ao contrário, pode representar a protelação dos processos.",PL 553/2019,PL,553,2019,"Altera a Lei nº 9.605, de 12 de fevereiro de 1998, para prever critérios objetivos para a aplicação da pena à pessoa jurídica condenada por crime ambiental.",135108,senado,Meio ambiente,Styvenson Valentim PODEMOS / RN,https://www25.senado.leg.br/web/atividade/materias/-/materia/135108
Sim,Negativo,PDL 564/2019,PDL,564,2019,"Autoriza, nos termos dos arts. 49, inciso XVI, 176, § 1º, e 231, § 3º, da Constituição Federal, a implantação do aproveitamento hidrelétrico de Iraí, localizado no Rio Uruguai, atingindo parte da Terra Indígena Kaingang de Iraí, no Estado do Rio Grande do Sul",138337,senado,Nao especificado,Luis Carlos Heinze PP / RS,https://www25.senado.leg.br/web/atividade/materias/-/materia/138337
Sim,Positivo,PL 616/2019,PL,616,2019,"Altera a Lei nº 6.360, de 23 de setembro de 1976, que dispõe sobre a vigilância sanitária a que ficam sujeitos os medicamentos, as drogas, os insumos farmacêuticos e correlatos, cosméticos, saneantes e outros produtos, e dá outras providências, para dispor sobre a regulação ambiental de cosméticos, e dispõe sobre a proibição de protetores solares considerados tóxicos para os recifes de corais.",135169,senado,Meio ambiente,Lasier Martins PODEMOS / RS,https://www25.senado.leg.br/web/atividade/materias/-/materia/135169
Sim,Neutro: alguns conceitos requerem um definição mais abrangente de modo a não permitirem subterfúgios e efetivamente garantirem a respnsabilização em caso de eventos envolvendo ruptura de barragens.,PL 635/2019,PL,635,2019,"Altera a Lei nº 12.334, de 20 de setembro de 2010, para reforçar a efetividade da Política Nacional de Segurança de Barragens (PNSB), e a Lei nº 9.433, de 8 de janeiro de 1997, para dotar de novos instrumentos o Conselho Nacional de Recursos Hídricos (CNRH), no exercício de sua atribuição de zelar pela implementação da PNSB.",135161,senado,Recursos hídricos,Lasier Martins PODEMOS / RS,https://www25.senado.leg.br/web/atividade/materias/-/materia/135161
Sim,Positivo,PL 639/2019,PL,639,2019,"Altera o art. 32 da Lei nº 9.605, de 12 de fevereiro de 1998, para tipificar como crime de maus-tratos a conduta do agente público que, injustificadamente, sacrificar animais apreendidos ou deixar de soltá-los em seu habitat natural ou de destiná-los a pessoas ou entidades que por eles queiram se responsabilizar.",135158,senado,Meio ambiente,Telmário Mota PROS / RR,https://www25.senado.leg.br/web/atividade/materias/-/materia/135158
Sim,Positivo,PL 646/2019,PL,646,2019,"Altera a Lei nº 12.334, de 20 de setembro de 2010, para reforçar a efetividade da Política Nacional de Segurança de Barragens (PNSB); a Lei nº 9.433, de 8 de janeiro de 1997, para dotar de novos instrumentos o Conselho Nacional de Recursos Hídricos (CNRH) no exercício de sua atribuição de zelar pela implementação da PNSB; a Lei nº 8.072, de 25 de julho de 1990, para tornar hediondo o crime de poluição ambiental com resultado morte; e a Lei nº 9.605, de 12 de fevereiro de 1998, para instituir causa de aumento de pena no crime de poluição com resultado de morte.",135179,senado,Meio ambiente,Randolfe Rodrigues REDE / AP,https://www25.senado.leg.br/web/atividade/materias/-/materia/135179
,Não relacionada ao meio ambiente ou clima.,PL 658/2019,PL,658,2019,"Acrescenta-se o artigo 5°A a Lei nº 11.326, de 24 de julho de 2006, que estabelece as diretrizes para a formulação da Política Nacional da Agricultura Familiar e Empreendimentos Familiares Rurais.",135211,senado,"Agricultura, pecuária e abastecimento",Weverton PDT / MA,https://www25.senado.leg.br/web/atividade/materias/-/materia/135211
Sim,positivo,PL 690/2019,PL,690,2019,Dispõe sobre a concessão do Selo Estabelecimento Sustentável.,135207,senado,Meio ambiente,Jorginho Mello PL / SC,https://www25.senado.leg.br/web/atividade/materias/-/materia/135207
Sim,"Positivo: promove o aumento da participação da água de reúso no concumo de plantas industriais e prédios comerciais, favorecendo a preservação de recursos hídricos em localizades com baixos índices pluviométricos.",PL 724/2019,PL,724,2019,Torna obrigatória a utilização de patamares mínimos de água de reúso por plantas industriais e prédios comerciais que se instalarem em regiões de baixa precipitação pluviométrica.,135230,senado,Meio ambiente,Veneziano Vital do Rêgo PSB / PB,https://www25.senado.leg.br/web/atividade/materias/-/materia/135230
,Não relacionada ao meio ambiente ou clima.,PL 735/2020,PL,735,2020,"Dispõe sobre medidas emergenciais de amparo aos agricultores familiares do Brasil para mitigar os impactos socioeconômicos da Covid–19; altera as Leis nºs 13.340, de 28 de setembro de 2016, e 13.606, de 9 de janeiro de 2018; e dá outras providências (Lei Assis Carvalho).",143587,senado,"Agricultura, pecuária e abastecimento",Câmara dos Deputados,https://www25.senado.leg.br/web/atividade/materias/-/materia/143587
Sim,Positivo,PL 754/2019,PL,754,2019,"Altera dispositivos da Lei nº 12.512, de 14 de outubro de 2011, para ampliar a relação de beneficiários do Programa de Apoio à Conservação Ambiental.",135240,senado,Meio ambiente,Chico Rodrigues DEM / RR,https://www25.senado.leg.br/web/atividade/materias/-/materia/135240
,Não relacionada ao meio ambiente ou clima.,PL 764/2019,PL,764,2019,"Altera a redação do Decreto-Lei nº 79, de 19 de dezembro de 1966, que institui normas para fixação de preços mínimos e execução das operações de financiamento e aquisição de produtos agropecuários e adota outras providências.",135239,senado,"Agricultura, pecuária e abastecimento",Chico Rodrigues DEM / RR,https://www25.senado.leg.br/web/atividade/materias/-/materia/135239
